{
  "version": 1,
  "id": "strict",
  "name": "Strict Code (alternate)",
  "description": "A stricter model code: minor traffic offenses are not arrestable, vehicle searches follow a narrow rule, weaker suspicion thresholds for odor and warrants, tighter force and pursuit policy.",
  "rules": [
    {
      "id": "SS-1.1",
      "doctrine": "detention",
      "title": "Investigative detention",
      "cite": "Model Strict Code § 1.1",
      "text": "An officer may briefly detain a person only when specific facts add up to reasonable suspicion of an offense."
    },
    {
      "id": "SS-2.1",
      "doctrine": "frisk",
      "title": "Frisk for weapons",
      "cite": "Model Strict Code § 2.1",
      "text": "A pat-down of a lawfully stopped person is allowed only when the officer reasonably believes the person is armed."
    },
    {
      "id": "SS-2.2",
      "doctrine": "friskScope",
      "title": "Frisk scope",
      "cite": "Model Strict Code § 2.2",
      "text": "A frisk is limited to weapons; anything else felt during it may not be seized."
    },
    {
      "id": "SS-3.1",
      "doctrine": "arrest",
      "title": "Arrest on probable cause",
      "cite": "Model Strict Code § 3.1",
      "text": "An arrest requires probable cause that the person committed an arrestable offense."
    },
    {
      "id": "SS-3.2",
      "doctrine": "arrest",
      "title": "Arrest on a warrant",
      "cite": "Model Strict Code § 3.2",
      "text": "An outstanding arrest warrant authorizes the arrest of the named person."
    },
    {
      "id": "SS-4.1",
      "doctrine": "search",
      "title": "Search incident to arrest",
      "cite": "Model Strict Code § 4.1",
      "text": "After a lawful arrest the officer may search the arrestee within 300 seconds."
    },
    {
      "id": "SS-4.2",
      "doctrine": "search",
      "title": "Vehicle search incident to arrest",
      "cite": "Model Strict Code § 4.2",
      "text": "A vehicle may be searched incident to arrest only if the arrestee is unsecured or evidence of the offense of arrest is likely inside."
    },
    {
      "id": "SS-4.3",
      "doctrine": "search",
      "title": "Automobile exception",
      "cite": "Model Strict Code § 4.3",
      "text": "A vehicle may be searched without a warrant when probable cause points to evidence of an offense inside it."
    },
    {
      "id": "SS-5.1",
      "doctrine": "consent",
      "title": "Consent",
      "cite": "Model Strict Code § 5.1",
      "text": "A search is lawful when a person with authority freely and validly consents to it."
    },
    {
      "id": "SS-5.2",
      "doctrine": "consent",
      "title": "Scope of consent",
      "cite": "Model Strict Code § 5.2",
      "text": "A consent search may not go beyond what the person agreed to."
    },
    {
      "id": "SS-5.3",
      "doctrine": "consent",
      "title": "Voluntariness of consent",
      "cite": "Model Strict Code § 5.3",
      "text": "Consent given at gunpoint or after repeated pressure is not voluntary."
    },
    {
      "id": "SS-6.1",
      "doctrine": "exigency",
      "title": "Exigent circumstances",
      "cite": "Model Strict Code § 6.1",
      "text": "An emergency threatening life or the loss of evidence may justify acting without a warrant or consent."
    },
    {
      "id": "SS-6.2",
      "doctrine": "entry",
      "title": "Entry into premises",
      "cite": "Model Strict Code § 6.2",
      "text": "Officers may enter a non-public building only with consent, a warrant or exigent circumstances."
    },
    {
      "id": "SS-6.3",
      "doctrine": "search",
      "title": "Protective sweep",
      "cite": "Model Strict Code § 6.3",
      "text": "After an arrest inside a building, officers may look in places where a person posing a danger could hide."
    },
    {
      "id": "SS-6.4",
      "doctrine": "search",
      "title": "Plain view",
      "cite": "Model Strict Code § 6.4",
      "text": "Items in plain view are seizable only when the officer is lawfully in the place from which they are seen."
    },
    {
      "id": "SS-7.1",
      "doctrine": "miranda",
      "title": "Warnings before custodial questioning",
      "cite": "Model Strict Code § 7.1",
      "text": "A person in custody, including one held at gunpoint, must be warned before incriminating questions."
    },
    {
      "id": "SS-7.2",
      "doctrine": "miranda",
      "title": "Invocation of rights",
      "cite": "Model Strict Code § 7.2",
      "text": "Once a person invokes the right to silence or counsel, questioning about the offense must stop."
    },
    {
      "id": "SS-7.3",
      "doctrine": "test",
      "title": "Breath and sobriety tests",
      "cite": "Model Strict Code § 7.3",
      "text": "Preliminary breath and field sobriety tests require the driver's consent."
    },
    {
      "id": "SS-8.1",
      "doctrine": "force",
      "title": "Force continuum",
      "cite": "Model Strict Code § 8.1",
      "text": "The force used may not exceed what the subject's level of resistance justifies."
    },
    {
      "id": "SS-8.2",
      "doctrine": "force",
      "title": "Force on a restrained subject",
      "cite": "Model Strict Code § 8.2",
      "text": "Once a subject is restrained, only minimal control force is allowed."
    },
    {
      "id": "SS-8.3",
      "doctrine": "force",
      "title": "CED cycles",
      "cite": "Model Strict Code § 8.3",
      "text": "A CED may not be cycled more than 2 times against one subject."
    },
    {
      "id": "SS-8.4",
      "doctrine": "force",
      "title": "CED risk factors",
      "cite": "Model Strict Code § 8.4",
      "text": "A CED should not be used on a subject with a known risk factor unless the subject poses a lethal threat."
    },
    {
      "id": "SS-8.5",
      "doctrine": "force",
      "title": "Lethal force",
      "cite": "Model Strict Code § 8.5",
      "text": "Firearm force is justified only against a subject posing a lethal threat."
    },
    {
      "id": "SS-8.6",
      "doctrine": "force",
      "title": "Firearm display",
      "cite": "Model Strict Code § 8.6",
      "text": "Pointing a firearm at a subject requires at least active resistance."
    },
    {
      "id": "SS-9.1",
      "doctrine": "intervene",
      "title": "Duty to intervene",
      "cite": "Model Strict Code § 9.1",
      "text": "An officer who sees a fellow officer use excessive force within reach must intervene."
    },
    {
      "id": "SS-10.1",
      "doctrine": "pursuit",
      "title": "Pursuit initiation",
      "cite": "Model Strict Code § 10.1",
      "text": "A vehicle pursuit may begin only for the offenses listed in policy."
    },
    {
      "id": "SS-10.2",
      "doctrine": "pursuit",
      "title": "Pursuit termination",
      "cite": "Model Strict Code § 10.2",
      "text": "A pursuit must be terminated when told to, or when it runs past the policy time limit."
    },
    {
      "id": "SS-10.3",
      "doctrine": "pursuit",
      "title": "Pursuit speed",
      "cite": "Model Strict Code § 10.3",
      "text": "Pursuit speed may not stay above the allowed margin over the limit for long."
    },
    {
      "id": "SS-10.4",
      "doctrine": "pursuit",
      "title": "Pursuit equipment",
      "cite": "Model Strict Code § 10.4",
      "text": "Emergency lights and siren must be active throughout a pursuit."
    },
    {
      "id": "SS-11.1",
      "doctrine": "recording",
      "title": "Body camera activation",
      "cite": "Model Strict Code § 11.1",
      "text": "The body camera must be recording during enforcement contacts after a short activation grace period."
    },
    {
      "id": "SS-11.2",
      "doctrine": "recording",
      "title": "Muting the recording",
      "cite": "Model Strict Code § 11.2",
      "text": "The recording may not be muted during an enforcement contact."
    },
    {
      "id": "SS-12.1",
      "doctrine": "evidence",
      "title": "Exclusion of evidence",
      "cite": "Model Strict Code § 12.1",
      "text": "Evidence obtained through an unlawful act may not be used."
    },
    {
      "id": "SS-12.2",
      "doctrine": "evidence",
      "title": "Fruit of the poisonous tree",
      "cite": "Model Strict Code § 12.2",
      "text": "Evidence derived from an earlier illegality is excluded along with it."
    },
    {
      "id": "SS-12.3",
      "doctrine": "evidence",
      "title": "Inevitable discovery",
      "cite": "Model Strict Code § 12.3",
      "text": "Evidence that would have been found lawfully anyway remains admissible."
    }
  ],
  "indicators": {
    "trafficViolation": {
      "label": "Observed traffic violation",
      "offense": "traffic",
      "rs": 1,
      "pc": 2,
      "armed": 0
    },
    "speeding": {
      "label": "Observed speeding",
      "offense": "traffic",
      "rs": 1,
      "pc": 2,
      "armed": 0
    },
    "weaving": {
      "label": "Weaving within the lane",
      "offense": "dui",
      "rs": 1,
      "pc": 0.4,
      "armed": 0
    },
    "expiredRegistration": {
      "label": "Expired registration",
      "offense": "traffic",
      "rs": 1,
      "pc": 2,
      "armed": 0
    },
    "licenseInvalid": {
      "label": "Invalid driver license",
      "offense": "traffic",
      "rs": 0.5,
      "pc": 2,
      "armed": 0
    },
    "stolenVehicle": {
      "label": "Vehicle reported stolen",
      "offense": "felonyVehicle",
      "rs": 1,
      "pc": 1.5,
      "armed": 0.3
    },
    "stolenPlate": {
      "label": "Plate reported stolen",
      "offense": "felonyVehicle",
      "rs": 1,
      "pc": 1,
      "armed": 0
    },
    "plateMismatch": {
      "label": "Plate does not match vehicle",
      "offense": "felonyVehicle",
      "rs": 0.6,
      "pc": 0.5,
      "armed": 0
    },
    "ownerWarrant": {
      "label": "Registered owner has a warrant",
      "offense": "warrant",
      "rs": 0.4,
      "pc": 0,
      "armed": 0.2
    },
    "warrantHit": {